status,date_published,date_added,title,description,publisher,link,sentiment,score
🤖 Auto,2026-03-10 19:16:00+00:00,3/28/26 9:57,AI Bottlenecks: 3 Stocks Poised to Gain from the AI Buildout,"The real fortunes in AI will be made from companies providing the essential memory, energy, and physical space that make artificial intelligence possible.",Yahoo Entertainment,https://finance.yahoo.com/news/ai-bottlenecks-3-stocks-poised-191600590.html,Positive,0.86
🤖 Auto,2026-03-20 17:33:48+00:00,3/28/26 9:57,Online age checks came first — a VPN crackdown could be next,"This is The Stepback, a weekly newsletter breaking down one essential story from the tech world. For more news about online age verification and your privacy, follow Emma Roth. The Stepback arrives in our subscribers' inboxes at 8AM ET. Opt in for The Stepbac…",The Verge,https://www.theverge.com/column/898122/online-age-verification-vpns,Neutral,0
🤖 Auto,2026-03-05 09:18:00+00:00,3/28/26 9:57,"2 Artificial Intelligence (AI) Stocks With 75% and 280% Upside to Buy Now, According to Wall Street Analysts",,Yahoo Entertainment,https://consent.yahoo.com/v2/collectConsent?sessionId=1_cc-session_8ae3d7f3-3b9e-45fc-8ec3-e1537866073a,Positive,0.48
🤖 Auto,2026-03-21 14:34:00+00:00,3/28/26 9:57,"Jeff Bezos Seeking $100 Billion to Buy Manufacturing Companies, 'Transform' Them With AI","Jeff Bezos ""is in early talks to raise $100 billion,"" reports the Wall Street Journal, ""for a new fund that would buy up manufacturing companies and seek to use AI technology to accelerate their path to automation."" 

""The Amazon.com founder is meeting with s…",Slashdot.org,https://slashdot.org/story/26/03/21/0529209/jeff-bezos-seeking-100-billion-to-buy-manufacturing-companies-transform-them-with-ai,Neutral,0
🤖 Auto,2026-03-20 19:00:21+00:00,3/28/26 9:57,Trump Proposes a ‘Light Touch’ National Framework for AI Policy,The next closest thing to no rules at all.,Gizmodo.com,https://gizmodo.com/trump-proposes-a-light-touch-national-framework-for-ai-policy-2000736105,Negative,-0.3
🤖 Auto,2026-02-27 13:52:00+00:00,3/27/26 7:34,The Cybersecurity Market Is Set to Double to $300 Billion by 2030. Here's the Best Artificial Intelligence (AI) Stock to Buy Now.,,Yahoo Entertainment,https://consent.yahoo.com/v2/collectConsent?sessionId=1_cc-session_e6db2e7f-8613-4a7d-991f-f6d2c1613e73,Positive,0.81
🤖 Auto,2026-02-26 23:14:44+00:00,3/27/26 7:34,Anthropic says company 'cannot in good conscience accede' to Pentagon's demands,Anthropic CEO Dario Amodei says the artificial intelligence company “cannot in good conscience accede” to the Pentagon’s demands to allow wider use of its technology. The Pentagon’s top spokesman is reiterating that the military wants to use Anthropic’s artif…,Associated Press,https://apnews.com/article/anthropic-ai-pentagon-hegseth-dario-amodei-9b28dda41bdb52b6a378fa9fc80b8fda,Positive,0.74
🤖 Auto,2026-02-26 21:00:34+00:00,3/27/26 7:34,"Stock market today: S&P 500, Nasdaq retreat as Nvidia falls 5% despite stellar earnings",Investors are assessing Nvidia's earnings report for a steer on the AI trade.,Yahoo Entertainment,https://finance.yahoo.com/news/live/stock-market-today-sp-500-nasdaq-retreat-as-nvidia-falls-5-despite-stellar-earnings-210034836.html,Positive,0.2
🤖 Auto,2026-02-27 15:30:11+00:00,3/27/26 7:34,Bitcoin Crashed 50% in 4 Months. Fidelity Says That’s a Good Thing,Fidelity Digital Assets analysts do see one ray of hope for bitcoin maxis.,Gizmodo.com,https://gizmodo.com/bitcoin-crashed-50-in-4-months-fidelity-says-thats-a-good-thing-2000727284,Positive,0.76
🤖 Auto,2026-02-27 02:19:45+00:00,3/27/26 7:34,Deadline looms as Anthropic rejects Pentagon demands it remove AI safeguards,The Defense Department has been feuding with Anthropic over military uses of its artificial intelligence tools. At stake are hundreds of millions of dollars in contracts and access to some of the most advanced AI on the planet.,NPR,https://www.npr.org/2026/02/26/nx-s1-5727847/anthropic-defense-hegseth-ai-weapons-surveillance,Positive,0.22
🤖 Auto,2026-02-26 15:08:53+00:00,3/27/26 7:34,We asked experts how to build a resume for the AI hiring era,"With AI-backed hiring on the rise, tips for ""hacking"" your resume are all over social media. As job search companies increasingly rely on artificial intelligence to sort through applications, job seekers wonder how to best position themselves with those filte…",The Verge,https://www.theverge.com/featured-video/884368/we-asked-experts-how-to-build-a-resume-for-the-ai-hiring-era,Positive,0.81
🤖 Auto,2026-02-27 15:25:07+00:00,3/27/26 7:34,Block's layoffs illustrate the market conundrum at the heart of the viral Citrini report,"Investors cheered Block's big layoffs, but the move also flicks at the tension between markets and the economy Citrini highligthed in its viral AI note.",Business Insider,https://www.businessinsider.com/block-layoffs-ai-job-cuts-white-collar-recession-outlook-2026-2,Positive,0.2
🤖 Auto,2026-02-27 11:35:15+00:00,3/27/26 7:34,Block's Jack Dorsey wants nimble and quick. He thinks AI will do the trick.,Block CEO Jack Dorsey said he's cutting nearly half his staff following a significant uptick in AI capabilities.,Business Insider,https://www.businessinsider.com/jack-dorsey-block-job-cuts-ai-2026-2,Negative,-0.42
🤖 Auto,2026-02-27 08:53:41+00:00,3/27/26 7:34,'I would never say that' - US Olympian on White House AI video,"USA men's ice hockey player Brady Tkachuk distances himself from an AI-enhanced White House video in which he appears to disparage Canadians, saying ""those words would never come out of my mouth"".",BBC News,https://www.bbc.com/sport/ice-hockey/articles/cqj9w4xz1l0o,Negative,-0.46
🤖 Auto,2026-02-26 12:58:23+00:00,3/26/26 10:54,"Firefox gets ""modern AI browser"" features, but don't worry — Mozilla knows you'll hate it and already added an AI killswitch button","Firefox version 148 adds an AI ""killswitch"" to remove artificial intelligence implementations from affecting your browsing experience.",Windows Central,https://www.windowscentral.com/software-apps/mozilla-firefox-browser-adds-ai-killswitch,Positive,0.3
🤖 Auto,2026-02-26 10:33:01+00:00,3/26/26 10:54,Lowe's CEO says its AI assistant is fixing some major headaches,"Lowe's CEO Marvin Ellison is all in on artificial intelligence, with the home improvement retailer using tech at nearly every level of its operation.",Business Insider,https://www.businessinsider.com/lowes-ceo-says-mylow-ai-assistant-is-fixing-major-headaches-2026-2,Positive,0.73
🤖 Auto,2026-02-26 14:27:49+00:00,3/26/26 10:54,Anthropic gives its retired Claude AI a Substack,"In January, Anthropic ""retired"" Claude 3 Opus, which at one time was the company's most powerful AI model. Today, it's back - and writing on Substack. The newsletter, called Claude's Corner, will give Opus 3 space to publish its ""musings, insights, or creativ…",The Verge,https://www.theverge.com/ai-artificial-intelligence/885200/anthropic-retired-claude-given-a-substack,Positive,0.48
🤖 Auto,2026-02-25 09:30:00+00:00,3/25/26 10:30,"How Mexico's ‘CJNG’ Drug Cartel Embraced AI, Drones, and Social Media","Drug kingpin Nemesio “El Mencho” Oseguera Cervantes may be dead, but the Jalisco cartel he ran for years will likely outlive him—thanks, in part, to the criminal group’s embrace of technology.",Wired,https://www.wired.com/story/how-mexicos-cjng-drug-cartel-embraced-ai-drones-and-social-media/,Negative,-0.65
🤖 Auto,2026-02-24 20:40:00+00:00,3/25/26 10:30,"Nvidia Just Sold Its Stake in Applied Digital and Arm Holdings and Piled Into a New Artificial Intelligence GPU Player Up Over 7,200% Since Its IPO",,Yahoo Entertainment,https://consent.yahoo.com/v2/collectConsent?sessionId=1_cc-session_6525d663-3422-4c4e-a60c-4409a244bb94,Positive,0.48
🤖 Auto,2026-02-24 20:26:53+00:00,3/25/26 10:30,"Hegseth threatens to cancel Anthropic's $200 million contract over ""woke AI"" concerns",The company's Claude chatbot is one of the few AI systems cleared for use in classified settings. But a standoff between Anthropic and the Trump administration is putting its government work at risk.,NPR,https://www.npr.org/2026/02/24/nx-s1-5725327/pentagon-anthropic-hegseth-safety,Negative,-0.58
🤖 Auto,2026-02-24 19:11:11+00:00,3/25/26 10:30,"These Are the Top 5 Stocks to Own for 2026, According to ChatGPT","With fears rippling across Wall Street that LLMs can replace white-collar jobs, can ChatGPT replace your money manager, too?",Barchart.com,https://www.barchart.com/story/news/395715/these-are-the-top-5-stocks-to-own-for-2026-according-to-chatgpt,Negative,-0.25
🤖 Auto,2026-02-23 21:16:28+00:00,3/24/26 8:35,Circle to Search has 3 secret powers most people don’t know about,"Circle to Search is a few years old now, but it has consistently gained features over its lifetime that make it a worthwhile tool to this day.",Android Central,https://www.androidcentral.com/apps-software/ai/circle-to-search-is-still-google-best-ai-feature,Positive,0.76
🤖 Auto,2026-02-23 23:25:32+00:00,3/24/26 8:35,An AI Thought Experiment on Substack Is Sending The Stock Market Spiraling,"AI is coming for everything, Wall Street seems to believe.",Gizmodo.com,https://gizmodo.com/an-ai-thought-experiment-on-substack-is-sending-the-stock-market-spiraling-2000725601,Neutral,0
🤖 Auto,2026-02-23 19:50:30+00:00,3/24/26 8:35,Meta Exec Learns the Hard Way That AI Can Just Delete Your Stuff,One small trick to get you to inbox zero.,Gizmodo.com,https://gizmodo.com/meta-exec-learns-the-hard-way-that-ai-can-just-delete-your-stuff-2000725450,Negative,-0.15